{
  "name": "Shining Armor",
  "type": "kit",
  "kit_type": "Martial",
  "flavor": "The Shining Armor kit provides the most protection a kit can afford, providing you with the sword, shield, and armor necessary to play the prototypical knight.",
  "armor": ["Heavy Armor", "Shield"],
  "weapon": ["Medium Weapon"],
  "equipment_text": "You wear heavy armor and wield a shield and a medium weapon.",
  "stamina_bonus": "+12 per echelon",
  "stability_bonus": "+1",
  "melee_damage_bonus": "+2/+2/+2",
  "signature_ability": {
    "type": "feature",
    "feature_type": "ability",
    "name": "Protective Attack",
    "flavor": "The strength of your assault makes it impossible for your foe to ignore you.",
    "keywords": ["Melee", "Strike", "Weapon"],
    "usage": "Main action",
    "distance": "Melee 1",
    "target": "One creature",
    "effects": [
      {
        "roll": "Power Roll + Might or Agility",
        "tier1": "5 + M or A damage",
        "tier2": "8 + M or A damage",
        "tier3": "11 + M or A damage"
      },
      {
        "effect": "The target is taunted until the end of their next turn."
      }
    ]
  },
  "metadata": {
    "scc": ["mcdm.heroes.v1:kit:shining-armor"],
    "source": "mcdm.heroes.v1"
  }
}
